{
  "schemaVersion": 1,
  "taskId": "POSTG-APP-W02-A00_13SourceNodeApplicationCapabilityAssessmentAndAdmissionBaseline",
  "taskClass": "runtime",
  "targetEvidenceLevel": "E3_SHADOW_RUNTIME_INTEGRATED",
  "actualEvidenceLevel": "E3_SHADOW_RUNTIME_INTEGRATED",
  "claimedStatus": "W02_SOURCE13_AUTHORITY_AND_READINESS_BASELINE_READY",
  "claims": {
    "dataStructureReady": true,
    "contentAuthored": true,
    "runtimeIntegrated": true,
    "productionEquivalentGeneratorUsed": false,
    "productionRendererUsed": false,
    "htmlOutputVerified": false,
    "pdfOutputVerified": false,
    "visibleOutputChanged": false,
    "humanReviewReady": false,
    "productionAdmitted": false,
    "d0Complete": false
  },
  "evidence": {
    "runtimeTestPaths": [
      "src/curriculum/application/w02-source13-application-assessment.mjs",
      "tools/curriculum/validate-postg-app-w02-a00-assessment.mjs",
      "tests/curriculum/postg-app-w02-a00-assessment.test.js",
      "src/curriculum/application/postg-app-master-controller.mjs",
      "tests/curriculum/postg-app-m00-master-controller.test.js",
      ".github/workflows/postg-app-w02-a00-source-assessment.yml"
    ],
    "rendererTestPaths": [],
    "htmlArtifactPaths": [],
    "pdfArtifactPaths": [],
    "beforeAfterEvidencePaths": [
      "data/curriculum/application/assessment/w02-source13-source-authority-baseline.json",
      "data/curriculum/application/assessment/w02-source13-application-capability-policy.json",
      "data/curriculum/application/assessment/w02-source13-application-assessment-index.json",
      "data/curriculum/application/contracts/POSTG-APP-W02-A00_13SourceNodeApplicationCapabilityAssessmentAndAdmissionBaseline.json",
      "data/curriculum/application/controller/postg-app-master-controller-state.json",
      "docs/curriculum/output/POSTG_APP_W02_A00_SOURCE_ASSESSMENT_READY.marker",
      "docs/curriculum/output/POSTG_APP_W02_A00_SOURCE_ASSESSMENT_READBACK.md"
    ],
    "reviewArtifactPaths": [],
    "artifactHashes": []
  },
  "humanReview": {
    "type": "none",
    "canUnlockProduction": false,
    "reviewArtifactRequired": false
  },
  "distance": {
    "before": "D4",
    "after": "D4",
    "distanceReduced": "Wave 02 moves from a controller-only 13-node queue to a deterministic source-authority and KnowledgeOperation-readiness baseline. All source metadata identities, queue order, expected registry paths and readiness decisions are machine-checkable, while KnowledgePoint classification, forced stories and production admission remain explicitly prohibited until A01 materializes KnowledgeOperation evidence."
  },
  "nextStep": {
    "taskId": "POSTG-APP-W02-A01_13SourceNodeKnowledgeOperationCandidateMaterializationAndKPClassification",
    "requiredEvidenceLevelBeforeStart": "E3_SHADOW_RUNTIME_INTEGRATED"
  }
}
